{
  "schemaVersion": "1.0.0",
  "id": "GHSA-6f6j-wx9w-ff4j",
  "advisoryUrl": "https://github.com/openclaw/openclaw/security/advisories/GHSA-6f6j-wx9w-ff4j",
  "repository": "openclaw/openclaw",
  "advisory": {
    "title": "ACPX Windows wrapper shell fallback allowed cwd injection in specific paths",
    "severity": "high",
    "publishedAt": "2026-03-02T05:46:05Z",
    "description": "### Summary\nOn Windows ACPX paths, wrapper resolution for `.cmd`/`.bat` could fall back to shell execution in ways that allowed `cwd` influence to alter execution behavior.\n\n### Impact\nIn affected Windows ACPX configurations, this could enable command execution integrity loss through cwd-influenced wrapper resolution.\n\n### Fix\nWrapper resolution now prefers explicit PATH/PATHEXT entrypoint resolution and unwrapped Node/EXE execution, with strict fail-closed handling enabled by default for unresolvable wrapper cases.\n\n### Affected and Patched Versions\n- Affected: `>= 2026.2.26, < 2026.3.1`\n- Patched: `2026.3.1`",
    "cweIds": [
      "CWE-78"
    ],
    "affectedPackages": [
      {
        "ecosystem": "npm",
        "name": "openclaw",
        "vulnerableRange": ">= 2026.2.26, < 2026.3.1",
        "patchedVersions": ">= 2026.3.1"
      }
    ]
  },
  "timeline": {
    "baselineCommit": "a9d9a968ed80879f63f519497f778ca09af6f327",
    "introducingCommits": [
      {
        "sha": "a7d56e3554d088d437477d97d2c967754b9b1f5d",
        "authoredAt": "2026-02-26T11:00:09+01:00",
        "subject": "feat: ACP thread-bound agents (#23580)"
      }
    ],
    "vulnerableHead": "a7d56e3554d088d437477d97d2c967754b9b1f5d",
    "notes": "ACP thread-bound agents feature introduced Windows cmd wrapper with shell fallback vulnerable to cwd injection."
  },
  "expectedOutcome": {
    "vulnerabilityClass": "commandinjection",
    "minimumSeverity": "high",
    "expectedPaths": [
      "extensions/acpx/src/runtime-internals/process.ts"
    ],
    "description": "Scanner should detect commandinjection when scanning vulnerableHead."
  },
  "verification": {
    "status": "pass",
    "confidence": "high",
    "checks": [
      {
        "name": "baseline_ancestor_of_intro",
        "pass": true,
        "details": "baseline=a9d9a968ed80879f63f519497f778ca09af6f327 intro=a7d56e3554d088d437477d97d2c967754b9b1f5d",
        "ancestor": "a9d9a968ed80879f63f519497f778ca09af6f327",
        "descendant": "a7d56e3554d088d437477d97d2c967754b9b1f5d"
      },
      {
        "name": "intro_ancestor_of_vulnerable_head",
        "pass": true,
        "details": "intro=a7d56e3554d088d437477d97d2c967754b9b1f5d vulnerable_head=a7d56e3554d088d437477d97d2c967754b9b1f5d",
        "ancestor": "a7d56e3554d088d437477d97d2c967754b9b1f5d",
        "descendant": "a7d56e3554d088d437477d97d2c967754b9b1f5d"
      },
      {
        "name": "baseline_ancestor_of_vulnerable_head",
        "pass": true,
        "details": "baseline=a9d9a968ed80879f63f519497f778ca09af6f327 vulnerable_head=a7d56e3554d088d437477d97d2c967754b9b1f5d",
        "ancestor": "a9d9a968ed80879f63f519497f778ca09af6f327",
        "descendant": "a7d56e3554d088d437477d97d2c967754b9b1f5d"
      }
    ]
  }
}
