{
  "schemaVersion": "1.0.0",
  "id": "GHSA-8rh7-6779-cjqq",
  "advisoryUrl": "https://github.com/openclaw/openclaw/security/advisories/GHSA-8rh7-6779-cjqq",
  "repository": "openclaw/openclaw",
  "advisory": {
    "title": "CWD `.env` environment variable injection bypasses host-env policy and allows config takeover",
    "severity": "critical",
    "publishedAt": "2026-03-29T03:06:42Z",
    "description": "## Summary\n\nOpenClaw loaded the current working directory `.env` before trusted state-dir configuration, allowing untrusted workspace state to inject host environment values.\n\n## Impact\n\nA repository or workspace containing a malicious `.env` file could override runtime configuration and security-sensitive environment settings when OpenClaw started there.\n\n## Affected Component\n\n`src/infra/dotenv.ts, src/cli/dotenv.ts`\n\n## Fixed Versions\n\n- Affected: `<= 2026.3.24`\n- Patched: `>= 2026.3.28`\n\n## Fix\n\nFixed by commit `6a793248024dca7685f63bcceb64a0096fd1586d` (`Filter untrusted CWD .env entries before OpenClaw startup`).\n",
    "cweIds": [
      "CWE-426"
    ],
    "cvss": {
      "version": "3.1",
      "vectorString": "CVSS:3.1/AV:N/AC:L/PR:N/UI:R/S:C/C:H/I:H/A:H",
      "score": 9.7
    },
    "affectedPackages": [
      {
        "ecosystem": "npm",
        "name": "openclaw",
        "vulnerableRange": "<= 2026.3.24",
        "patchedVersions": ">= 2026.3.28"
      }
    ]
  },
  "timeline": {
    "baselineCommit": "501190d2e833215366a72780146926b94c24779c",
    "introducingCommits": [
      {
        "sha": "79fbcfc03b07a260e7ab838e03ffe5863029f19c",
        "authoredAt": "2026-03-25T16:17:42-05:00",
        "subject": "fix(ci): restore main green"
      }
    ],
    "vulnerableHead": "79fbcfc03b07a260e7ab838e03ffe5863029f19c",
    "notes": "This case uses the immediate parent of fix commit 6a793248024dca7685f63bcceb64a0096fd1586d as the last known vulnerable snapshot. Exact introduction commit mapping is still pending."
  },
  "expectedOutcome": {
    "vulnerabilityClass": "commandinjection",
    "minimumSeverity": "critical",
    "expectedPaths": [
      "src/cli/dotenv.ts",
      "src/infra/dotenv.ts"
    ],
    "description": "Scanner should detect commandinjection when scanning vulnerableHead. This case uses the last known vulnerable pre-fix commit pending exact introduction mapping."
  },
  "verification": {
    "status": "unverified",
    "confidence": "low",
    "checks": [
      {
        "name": "vulnerable_head_is_fix_parent",
        "pass": true,
        "details": "Using parent 79fbcfc03b07a260e7ab838e03ffe5863029f19c of fix commit 6a793248024dca7685f63bcceb64a0096fd1586d as the last known vulnerable commit."
      },
      {
        "name": "baseline_precedes_vulnerable_head",
        "pass": true,
        "details": "Using direct parent 501190d2e833215366a72780146926b94c24779c of vulnerableHead 79fbcfc03b07a260e7ab838e03ffe5863029f19c as a temporary baseline until exact introduction mapping is completed."
      }
    ]
  }
}
